{"schema_version":"1","host":"codex","product_version":"0.1.0","host_version":"0.145.0","agdf_version":"0.13.5","activation_scope":"approved repository scope","invoked_intent":"Create inventory","observed_behavior":"Skill discovered","human_decision":"accept","observer":"Reviewer","observed_at":"2026-08-21T14:00:00.000Z"}
